{
  "account_id": "tiktok.obou_anicca",
  "adapter": "postiz",
  "asset_path": "/Users/anicca/anicca/skills/earn/marketing-engine/evidence/renderers/gate14/cohort-ja-008b-v3.mp4",
  "asset_sha256": "d7fc914884a87682a1e50f64b26d2377f41ad12cc7d4b2ea47dde913a83f6d18",
  "attribution_token": "ej_m7cfmkwpvmwmbomqi6g6",
  "caption": "画面の向こうの一言に、一日を奪われる前に。『アニッチャ・リセット』を読む https://aniccaai.com/go/ej_m7cfmkwpvmwmbomqi6g6 ej_m7cfmkwpvmwmbomqi6g6",
  "caption_sha256": "c144db62cf3bddddda285bfdb0916d8f7706529ddfdd4508f465d6301412ec55",
  "creative_id": "creative.4a6c3aa8a27201908baeb9de",
  "experiment_id": "experiment.cb02c76283d0d70014ec3229",
  "hook_id": "hook.tiktok.7469555236407872776.003",
  "integration_id": "cmo5s4edx00vgn10ygnu34a0n",
  "native_handle": "obou_anicca",
  "platform": "tiktok",
  "product_id": "ebook-ja",
  "provider_settings": {
    "__type": "tiktok",
    "autoAddMusic": "no",
    "brand_content_toggle": false,
    "brand_organic_toggle": false,
    "comment": true,
    "content_posting_method": "DIRECT_POST",
    "duet": false,
    "privacy_level": "PUBLIC_TO_EVERYONE",
    "stitch": false,
    "title": "",
    "video_made_with_ai": true
  },
  "publish_key": "publication.66151a9186d82b8d6e7d085f",
  "renderer_id": "watercolor-monk",
  "scheduled_at": "2026-08-09T11:15:00Z",
  "schema_version": "marketing.publication-intent.v2",
  "visual_approval_id": "visual.accepted.gate14-v3-item-008"
}
