{
  "account_id": "tiktok.obou_anicca",
  "adapter": "postiz",
  "asset_path": "/Users/anicca/anicca/skills/earn/marketing-engine/evidence/renderers/gate14/cohort-ja-010c-v3.mp4",
  "asset_sha256": "a5707485f0a29ba3b7eee68f92640ad34121bd332cf5ed94df766f44e44e8051",
  "attribution_token": "ej_aexsxn6gxir56rcnaj5z",
  "caption": "「こうなるはず」を一つ手放し、心の消耗を減らす。『アニッチャ・リセット』を読む https://aniccaai.com/go/ej_aexsxn6gxir56rcnaj5z ej_aexsxn6gxir56rcnaj5z",
  "caption_sha256": "e6c47ccb5ee89e0eb47be2fb4830b6e56107ff26ed5b8bfbec763688290c64c8",
  "creative_id": "creative.0d1697d7102bc85c0a8e5f2f",
  "experiment_id": "experiment.a89dc16bef0d141cc3a6310d",
  "hook_id": "hook.tiktok.7556571246406765832.002",
  "integration_id": "cmo5s4edx00vgn10ygnu34a0n",
  "native_handle": "obou_anicca",
  "platform": "tiktok",
  "product_id": "ebook-ja",
  "provider_settings": {
    "__type": "tiktok",
    "autoAddMusic": "no",
    "brand_content_toggle": false,
    "brand_organic_toggle": false,
    "comment": true,
    "content_posting_method": "DIRECT_POST",
    "duet": false,
    "privacy_level": "PUBLIC_TO_EVERYONE",
    "stitch": false,
    "title": "",
    "video_made_with_ai": true
  },
  "publish_key": "publication.f7173127fe6f46edea373863",
  "renderer_id": "watercolor-monk",
  "scheduled_at": "2026-08-11T11:15:00Z",
  "schema_version": "marketing.publication-intent.v2",
  "visual_approval_id": "visual.accepted.gate14-v3-item-010"
}
